{
  "reply": "Ada Muster leads the GlucoPatch sensor project and lists continuous glucose monitoring as a research topic. I lit up her unit on the map.",
  "mode": "mock",
  "abstained": false,
  "actions": [
    {
      "type": "show_on_map",
      "result": 0
    },
    {
      "type": "open_profile",
      "profile_id": "person-example-ada-muster"
    }
  ],
  "results": [
    {
      "query": "glucose sensors",
      "mode": "mock",
      "abstained": false,
      "abstain_reason": null,
      "expanded_terms": [
        {
          "term": "continuous glucose monitoring",
          "kind": "synonym",
          "lang": "en"
        },
        {
          "term": "CGM",
          "kind": "acronym",
          "lang": "en"
        },
        {
          "term": "Blutzuckersensor",
          "kind": "translation",
          "lang": "de"
        }
      ],
      "results": [
        {
          "rank": 1,
          "profile": {
            "id": "person-example-ada-muster",
            "kind": "person",
            "source_id": "example",
            "name": {
              "value": "Ada Muster",
              "method": "selector",
              "evidence": {
                "page_url": "https://www.example-institute.test/team/ada-muster",
                "page_sha256": "ae1bbd3174a5e9aa574bcf0527f27df85a86375c31e72b9ca0e3d96f7e5911d4",
                "span": "Dr. Ada Muster",
                "start": 0,
                "fetched_at": "2026-10-18T12:00:00Z"
              }
            },
            "source_url": "https://www.example-institute.test/team/ada-muster",
            "fields": {
              "role": [
                {
                  "value": "Group Leader",
                  "method": "selector",
                  "evidence": {
                    "page_url": "https://www.example-institute.test/team/ada-muster",
                    "page_sha256": "ae1bbd3174a5e9aa574bcf0527f27df85a86375c31e72b9ca0e3d96f7e5911d4",
                    "span": "Group Leader, Sensor Lab",
                    "start": 15,
                    "fetched_at": "2026-10-18T12:00:00Z"
                  }
                }
              ],
              "unit": [
                {
                  "value": "Sensor Lab",
                  "method": "selector",
                  "evidence": {
                    "page_url": "https://www.example-institute.test/team/ada-muster",
                    "page_sha256": "ae1bbd3174a5e9aa574bcf0527f27df85a86375c31e72b9ca0e3d96f7e5911d4",
                    "span": "Sensor Lab",
                    "start": 29,
                    "fetched_at": "2026-10-18T12:00:00Z"
                  }
                },
                {
                  "value": "Example Institute for Engineering",
                  "method": "selector",
                  "evidence": {
                    "page_url": "https://www.example-institute.test/team/ada-muster",
                    "page_sha256": "ae1bbd3174a5e9aa574bcf0527f27df85a86375c31e72b9ca0e3d96f7e5911d4",
                    "span": "Example Institute for Engineering",
                    "start": 40,
                    "fetched_at": "2026-10-18T12:00:00Z"
                  }
                }
              ],
              "expertise": [
                {
                  "value": "continuous glucose monitoring",
                  "method": "model",
                  "evidence": {
                    "page_url": "https://www.example-institute.test/team/ada-muster",
                    "page_sha256": "ae1bbd3174a5e9aa574bcf0527f27df85a86375c31e72b9ca0e3d96f7e5911d4",
                    "span": "continuous glucose monitoring",
                    "start": 84,
                    "fetched_at": "2026-10-18T12:00:00Z"
                  }
                },
                {
                  "value": "wearable biosensors",
                  "method": "model",
                  "evidence": {
                    "page_url": "https://www.example-institute.test/team/ada-muster",
                    "page_sha256": "ae1bbd3174a5e9aa574bcf0527f27df85a86375c31e72b9ca0e3d96f7e5911d4",
                    "span": "wearable biosensors",
                    "start": 115,
                    "fetched_at": "2026-10-18T12:00:00Z"
                  }
                }
              ],
              "projects": [
                {
                  "value": "GlucoPatch",
                  "method": "model",
                  "evidence": {
                    "page_url": "https://www.example-institute.test/team/ada-muster",
                    "page_sha256": "ae1bbd3174a5e9aa574bcf0527f27df85a86375c31e72b9ca0e3d96f7e5911d4",
                    "span": "GlucoPatch, a skin-worn sensor for people with type 1 diabetes",
                    "start": 179,
                    "fetched_at": "2026-10-18T12:00:00Z"
                  }
                }
              ],
              "infrastructure": [
                {
                  "value": "cleanroom for thin-film sensor fabrication",
                  "method": "model",
                  "evidence": {
                    "page_url": "https://www.example-institute.test/team/ada-muster",
                    "page_sha256": "ae1bbd3174a5e9aa574bcf0527f27df85a86375c31e72b9ca0e3d96f7e5911d4",
                    "span": "cleanroom for thin-film sensor fabrication",
                    "start": 259,
                    "fetched_at": "2026-10-18T12:00:00Z"
                  }
                }
              ],
              "services": []
            }
          },
          "reason": {
            "text": "Lists continuous glucose monitoring and wearable biosensors as research topics and leads the GlucoPatch sensor project.",
            "cites": [
              "/fields/expertise/0",
              "/fields/expertise/1",
              "/fields/projects/0"
            ]
          },
          "score": {
            "fused": 0.0325,
            "lexical_rank": 1,
            "vector_rank": 2
          }
        }
      ],
      "timings_ms": {
        "expand": 0,
        "search": 12,
        "explain": 0
      },
      "versions": {
        "engine": "0.0.0",
        "snapshot": "fixture",
        "prompts": "fixture",
        "models": {
          "expand": "MOCK-no-model"
        }
      }
    }
  ],
  "mentions": [
    {
      "profile_id": "person-example-ada-muster",
      "name": "Ada Muster"
    }
  ],
  "tool_calls": [
    {
      "tool": "search",
      "query": "glucose sensors"
    }
  ],
  "versions": {
    "engine": "0.0.0",
    "snapshot": "fixture",
    "prompts": "fixture",
    "models": {
      "agent": "MOCK-no-model"
    }
  }
}
